{"schema":"inbox-summary/v1","revision":"v1","page_size":16,"items":[{"message_id":"msg-0000","sender_id":"user-0","sender_name":"Mazi","duration_ms":2000,"unread":true,"preview":"Lab stub message 1 of 16","seq":1},{"message_id":"msg-0001","sender_id":"user-1","sender_name":"Arlo","duration_ms":2137,"unread":false,"preview":"Lab stub message 2 of 16","seq":2},{"message_id":"msg-0002","sender_id":"user-2","sender_name":"Lynn","duration_ms":2274,"unread":false,"preview":"Lab stub message 3 of 16","seq":3},{"message_id":"msg-0003","sender_id":"user-3","sender_name":"Audrey","duration_ms":2411,"unread":true,"preview":"Lab stub message 4 of 16","seq":4},{"message_id":"msg-0004","sender_id":"user-4","sender_name":"Guest","duration_ms":2548,"unread":false,"preview":"Lab stub message 5 of 16","seq":5},{"message_id":"msg-0005","sender_id":"user-0","sender_name":"Mazi","duration_ms":2685,"unread":false,"preview":"Lab stub message 6 of 16","seq":6},{"message_id":"msg-0006","sender_id":"user-1","sender_name":"Arlo","duration_ms":2822,"unread":true,"preview":"Lab stub message 7 of 16","seq":7},{"message_id":"msg-0007","sender_id":"user-2","sender_name":"Lynn","duration_ms":2959,"unread":false,"preview":"Lab stub message 8 of 16","seq":8},{"message_id":"msg-0008","sender_id":"user-3","sender_name":"Audrey","duration_ms":3096,"unread":false,"preview":"Lab stub message 9 of 16","seq":9},{"message_id":"msg-0009","sender_id":"user-4","sender_name":"Guest","duration_ms":3233,"unread":true,"preview":"Lab stub message 10 of 16","seq":10},{"message_id":"msg-0010","sender_id":"user-0","sender_name":"Mazi","duration_ms":3370,"unread":false,"preview":"Lab stub message 11 of 16","seq":11},{"message_id":"msg-0011","sender_id":"user-1","sender_name":"Arlo","duration_ms":3507,"unread":false,"preview":"Lab stub message 12 of 16","seq":12},{"message_id":"msg-0012","sender_id":"user-2","sender_name":"Lynn","duration_ms":3644,"unread":true,"preview":"Lab stub message 13 of 16","seq":13},{"message_id":"msg-0013","sender_id":"user-3","sender_name":"Audrey","duration_ms":3781,"unread":false,"preview":"Lab stub message 14 of 16","seq":14},{"message_id":"msg-0014","sender_id":"user-4","sender_name":"Guest","duration_ms":3918,"unread":false,"preview":"Lab stub message 15 of 16","seq":15},{"message_id":"msg-0015","sender_id":"user-0","sender_name":"Mazi","duration_ms":4055,"unread":true,"preview":"Lab stub message 16 of 16","seq":16}]}